{
  "schema_version": "0.1.0",
  "object_id": "OBJ-001",
  "lineage_id": "LIN-001",
  "leakage_group_id": "GRP-001",
  "dataset": "objaverse",
  "source_uid": "uid-001",
  "source_uri": "drive://private/object.glb",
  "creator_group": "creator-001",
  "category": "chair",
  "selection_stratum": "objaverse",
  "complexity_quantile": 4,
  "source_sha256": "aaaaaaaaaaaaaaaaaaaaaaaaaaaaaaaaaaaaaaaaaaaaaaaaaaaaaaaaaaaaaaaa",
  "source_size_bytes": 1024,
  "source_format": "glb",
  "format_status": "P2A_AUDITED_SUPPORTED",
  "licence": "CC-BY-4.0",
  "licence_source": "https://example.invalid/licence",
  "licence_spdx": "CC-BY-4.0",
  "licence_status": "REDISTRIBUTABLE",
  "provenance_status": "P2A_SOURCE_VERIFIED",
  "eligibility": "ELIGIBLE",
  "exclusion_reason": null,
  "topology_status": "V",
  "split": "development",
  "components": 1,
  "vertices": 8,
  "triangles": 12,
  "bbox": [-1, -1, -1, 1, 1, 1]
}
